{
  "schemaVersion": "1.0.0",
  "conceptId": "si:eval-run",
  "variantId": "variant-eval-run-outline-001",
  "status": "pass",
  "checks": {
    "viewBox": "pass",
    "currentColor": "pass",
    "strokeWidth": "pass",
    "strokeLinecap": "pass",
    "strokeLinejoin": "pass",
    "fill": "pass",
    "rasterEmbeds": "pass",
    "foreignObject": "pass",
    "hiddenText": "pass",
    "accessibleTitle": "fail",
    "shapeElementCount": "pass",
    "safeArea": "pass",
    "fixedColors": "pass"
  },
  "metrics": {
    "shapeElementCount": 4,
    "coordinateMin": 5,
    "coordinateMax": 19
  },
  "issues": [],
  "warnings": [
    "SVG should include title and desc elements."
  ]
}
